{
 "report_version": 1,
 "binding": "go",
 "binding_version": "0.0.0-synthetic",
 "platform": "linux/amd64",
 "goldens": {
  "clickhouse_version": "99.1.2.3",
  "build": "20990101.000000",
  "revision": 1,
  "sha256": "ee54f8ba6faef611e8f967b7b0b97456e7804a7dd2041b4c827461796dfc3d53"
 },
 "artifact": {
  "build_info_b64": "eyJzeW50aGV0aWMiOnRydWV9",
  "abi_fingerprint": "sha256:abababababababababababababababababababababababababababababababab"
 },
 "cases": [
  {
   "id": "schema-unknown-type",
   "setup": "utc",
   "result": "ran",
   "at": "schema_create",
   "status": "CHS_REJECTED",
   "error": {
    "ch_code": 50,
    "ch_name_b64": "VU5LTk9XTl9UWVBF",
    "message_b64": "VW5rbm93biBkYXRhIHR5cGUgZmFtaWx5OiBCb2d1cw==",
    "column_b64": ""
   },
   "decoded_ok": null
  },
  {
   "id": "schema-default-unknown-column",
   "setup": "utc",
   "result": "ran",
   "at": "schema_create",
   "status": "CHS_REJECTED",
   "error": {
    "ch_code": 47,
    "ch_name_b64": "VU5LTk9XTl9JREVOVElGSUVS",
    "message_b64": "VW5rbm93biBpZGVudGlmaWVyIHRtcF9jZDM0IGluIERFRkFVTFQ=",
    "column_b64": "bg=="
   },
   "decoded_ok": null
  },
  {
   "id": "json-overflow-wrap",
   "setup": "utc",
   "result": "ran",
   "at": "call",
   "status": "CHS_OK",
   "document_b64": "eyJjb2RlIjowLCJjb2xzIjpbeyJiYXNlIjoiVUludDgiLCJpbnB1dCI6IjMwMCIsImlzX3N0b3JlZCI6dHJ1ZSwibmFtZSI6Im4iLCJudWxsIjpmYWxzZSwicmVmIjoiMzAwIiwicmVmX3R5cGUiOiJVSW50MTYiLCJzcmMiOiJpbnB1dCIsInN0b3JlZF9iNjQiOiJORFE9IiwidHlwZSI6IlVJbnQ4In1dLCJlcnIiOiIiLCJpbnB1dF9zcGFuIjp7ImxlbiI6OCwib2ZmIjowfSwib3V0Y29tZSI6ImFjY2VwdGVkIiwidHJhbnNmb3JtZWQiOlt7ImNvbHVtbiI6Im4iLCJpbnB1dCI6IjMwMCIsImxvc3N5Ijp0cnVlLCJyZWFzb24iOiJvdmVyZmxvd193cmFwIiwic3RvcmVkIjoiNDQifV0sInVuc3VwcG9ydGVkX3NldHRpbmdzIjpbXX0=",
   "decoded_ok": true
  },
  {
   "id": "row-tsv-nonutf8-string-bytes",
   "setup": "utc",
   "result": "ran",
   "at": "call",
   "status": "CHS_OK",
   "document_b64": "eyJjb2RlIjowLCJjb2xzIjpbeyJiYXNlIjoiU3RyaW5nIiwiaW5wdXQiOiJcdTAwZmZcdTAwZmUiLCJpc19zdG9yZWQiOnRydWUsIm5hbWUiOiJzIiwibnVsbCI6ZmFsc2UsInNyYyI6ImlucHV0Iiwic3RvcmVkX2I2NCI6Ii8vND0iLCJ0eXBlIjoiU3RyaW5nIiwidmFsdWVfYjY0IjoiLy80PSJ9XSwiZXJyIjoiIiwiaW5wdXRfc3BhbiI6eyJsZW4iOjMsIm9mZiI6MH0sIm91dGNvbWUiOiJhY2NlcHRlZCIsInRyYW5zZm9ybWVkIjpbXSwidW5zdXBwb3J0ZWRfc2V0dGluZ3MiOltdfQ==",
   "decoded_ok": true
  },
  {
   "id": "row-json-default-rand",
   "setup": "utc",
   "result": "ran",
   "at": "call",
   "status": "CHS_OK",
   "document_b64": "eyJjb2RlIjowLCJjb2xzIjpbeyJuYW1lIjoibiIsInNyYyI6ImlucHV0Iiwic3RvcmVkIjoiMSJ9LHsibmFtZSI6InIiLCJyZWYiOiIyNzE4MjgxODI4Iiwic3JjIjoiZGVmYXVsdF9nZW5lcmF0ZWQiLCJzdG9yZWQiOiIyNzE4MjgxODI4In1dLCJlcnIiOiIiLCJvdXRjb21lIjoiYWNjZXB0ZWQiLCJ1bnN1cHBvcnRlZF9zZXR0aW5ncyI6W119",
   "decoded_ok": true
  },
  {
   "id": "json-two-rows",
   "setup": "utc",
   "result": "ran",
   "at": "call",
   "status": "CHS_OK",
   "document_b64": "eyJjb2RlIjowLCJlcnIiOiIiLCJmcmFtaW5nIjp7ImJvbV9za2lwcGVkIjpmYWxzZSwiY29udGFpbmVyIjoic3RyZWFtIiwiaGVhZGVyIjpudWxsfSwib3V0Y29tZSI6ImFjY2VwdGVkIiwicm93cyI6W3siY29kZSI6MCwiY29scyI6W3siYmFzZSI6IlVJbnQ4IiwiaW5wdXQiOiIxIiwiaXNfc3RvcmVkIjp0cnVlLCJuYW1lIjoibiIsIm51bGwiOmZhbHNlLCJzcmMiOiJpbnB1dCIsInN0b3JlZCI6IjEiLCJ0eXBlIjoiVUludDgifV0sImVyciI6IiIsImlucHV0X3NwYW4iOnsibGVuIjo4LCJvZmYiOjB9LCJvdXRjb21lIjoiYWNjZXB0ZWQiLCJ0cmFuc2Zvcm1lZCI6W10sInVuc3VwcG9ydGVkX3NldHRpbmdzIjpbXX0seyJjb2RlIjowLCJjb2xzIjpbeyJiYXNlIjoiVUludDgiLCJpbnB1dCI6IjIiLCJpc19zdG9yZWQiOnRydWUsIm5hbWUiOiJuIiwibnVsbCI6ZmFsc2UsInNyYyI6ImlucHV0Iiwic3RvcmVkIjoiMiIsInR5cGUiOiJVSW50OCJ9XSwiZXJyIjoiIiwiaW5wdXRfc3BhbiI6eyJsZW4iOjgsIm9mZiI6OH0sIm91dGNvbWUiOiJhY2NlcHRlZCIsInRyYW5zZm9ybWVkIjpbXSwidW5zdXBwb3J0ZWRfc2V0dGluZ3MiOltdfV0sInRyYW5zZm9ybWVkIjpbXSwidW5jb25zdW1lZCI6W119",
   "export_b64": "eyJuIjoxfQp7Im4iOjJ9Cg==",
   "decoded_ok": true
  },
  {
   "id": "filter-simple",
   "setup": "utc",
   "result": "ran",
   "at": "call",
   "status": "CHS_OK",
   "document_b64": "eyJjb2RlIjowLCJlcnIiOiIiLCJlcnJvcnMiOltdLCJvdXRjb21lIjoib2siLCJyb3dzX3JlYWQiOjIsInVuc3VwcG9ydGVkX3NldHRpbmdzIjpbXSwidmVyZGljdHMiOiJmdCJ9",
   "decoded_ok": true
  },
  {
   "id": "wire-tsv-array-null-element",
   "setup": "utc",
   "result": "ran",
   "at": "call",
   "status": "CHS_OK",
   "document_b64": "eyJjb2RlIjowLCJjb2xzIjpbeyJiYXNlIjoiQXJyYXkoU3RyaW5nKSIsImlucHV0IjoiW05VTExdIiwiaXNfc3RvcmVkIjp0cnVlLCJuYW1lIjoiYSIsIm51bGwiOmZhbHNlLCJzcmMiOiJpbnB1dCIsInN0b3JlZCI6IltcIlwiXSIsInR5cGUiOiJBcnJheShTdHJpbmcpIiwid2lyZSI6IlsnJ10ifV0sImVyciI6IiIsImlucHV0X3NwYW4iOnsibGVuIjo3LCJvZmYiOjB9LCJvdXRjb21lIjoiYWNjZXB0ZWQiLCJ0cmFuc2Zvcm1lZCI6W3siY29sdW1uIjoiYSIsImlucHV0IjoiW05VTExdIiwibG9zc3kiOnRydWUsInJlYXNvbiI6InZhbHVlX2NoYW5nZWQiLCJzdG9yZWQiOiJbXCJcIl0ifV0sInVuc3VwcG9ydGVkX3NldHRpbmdzIjpbXX0=",
   "decoded_ok": true
  },
  {
   "id": "wire-tsv-float32-precision",
   "setup": "utc",
   "result": "ran",
   "at": "call",
   "status": "CHS_OK",
   "document_b64": "eyJjb2RlIjowLCJjb2xzIjpbeyJiYXNlIjoiRmxvYXQzMiIsImlucHV0IjoiMC4xIiwiaXNfc3RvcmVkIjp0cnVlLCJuYW1lIjoiZiIsIm51bGwiOmZhbHNlLCJzcmMiOiJpbnB1dCIsInN0b3JlZCI6IjAuMSIsInR5cGUiOiJGbG9hdDMyIiwid2lyZSI6IjAuMSJ9XSwiZXJyIjoiIiwiaW5wdXRfc3BhbiI6eyJsZW4iOjQsIm9mZiI6MH0sIm91dGNvbWUiOiJhY2NlcHRlZCIsInRyYW5zZm9ybWVkIjpbXSwidW5zdXBwb3J0ZWRfc2V0dGluZ3MiOltdfQ==",
   "decoded_ok": true
  },
  {
   "id": "row-not-on-linux-amd64",
   "setup": "utc",
   "result": "skipped",
   "skip_reason": "the case's platforms exclude linux/amd64"
  },
  {
   "id": "zone-image-datetime",
   "setup": "kolkata",
   "result": "ran",
   "at": "call",
   "status": "CHS_OK",
   "document_b64": "eyJjb2RlIjowLCJjb2xzIjpbeyJiYXNlIjoiRGF0ZVRpbWUiLCJpbnB1dCI6IlwiMjA5OS0wMS0wMSAwMDowMDowMFwiIiwiaXNfc3RvcmVkIjp0cnVlLCJuYW1lIjoiZCIsIm51bGwiOmZhbHNlLCJzcmMiOiJpbnB1dCIsInN0b3JlZCI6IjIwOTgtMTItMzEgMTg6MzA6MDAiLCJ0eXBlIjoiRGF0ZVRpbWUifV0sImVyciI6IiIsImlucHV0X3NwYW4iOnsibGVuIjoyOCwib2ZmIjowfSwib3V0Y29tZSI6ImFjY2VwdGVkIiwidHJhbnNmb3JtZWQiOltdLCJ1bnN1cHBvcnRlZF9zZXR0aW5ncyI6W119",
   "decoded_ok": true
  }
 ]
}
